,song_sp_uri,song_name,song_isrc,song_popularity,song_lyrics,class,danceability,energy,key,loudness,mode,speechiness,acousticness,instrumentalness,liveness,valence,tempo,id,duration_ms,time_signature,artist_genres,artist_name,artist_photo,artist_popularity,artist_sp_followers
10,spotify:track:1rpwKiNxa37Imzse6ozDyi,Coração De Papel,BREMI6600010,37,"voce pensa coracao papel nao va pensando , pois nao igualzinho sofre fazer chorar assim ama voce pensa fazer chorar quer so pensa voce dia sentira amar bom demais nao jogue amor leu coracao nao papel 2x fazer chorar fazer sofrer coracao so quer amor lindo sei todo dei voce nao quis , jogou leu coracao nao papel ",Jovem Guarda,0.441,0.414,0,-15.937,1,0.0407,0.0352,3.6e-05,0.309,0.67,134.181,1rpwKiNxa37Imzse6ozDyi,186733,4,brega,Sérgio Reis,https://i.scdn.co/image/b7f3efbf2a00296425b64be1a949cf97b1a099a5,51,165957
11,spotify:track:5d9o4bCDL9LpqUcJ79nhXV,Diana,BRBMG5800009,35,"nao esquecas , amor amou sempre calor alma aqueceu sonho dois viveremos cantar can-tar amor , diana bracos querer quase sempre vou parar nao consigo esquecer oh ! diana vem sonhar quero , amor vem trazer-me calor vem vi-ver pra mim , diana vem querida , vida vem depressa , espero quero paixao oh ! oh ! oh ! oh ! oh ! oh ! oh ! oh ! oh ! oh ! only you pode fazer-me feliz only you tudo quis mim es felicidade ti morrer saudade vem amor , oh ! oh ! vem amor favor , oh ! oh ! vem pra mim vem vi-ver pra mim , diana pra mim , diana pra mim , diana ",Jovem Guarda,0.57,0.522,5,-5.417,1,0.0302,0.786,0.0,0.108,0.7,136.781,5d9o4bCDL9LpqUcJ79nhXV,146720,4,brega,Carlos Gonzaga,https://i.scdn.co/image/a5b5f8618f1ca5c05796ac286eb0a1e8e6e555ca,26,5047
12,spotify:track:3GDqL0krFiEwIehA9EBkFu,Pega Ladrão,BRSME6500134,38,"letra `` pega ladrao '' roberto carlos broto portao grito ouvi : `` pega ladrao ! '' alerta entao fiquei porem ninguem vi tal larapio esperei passar ali bem , apavorada , casa entrou despedida beijou ouviu-se entao rua tremendo alarido pois logo alguem pegou tal bandido roubou ? fez ? brotos responderam todos vez roubou coracao devolver senao sol quadrado vai ver nascer nao vou nessa historia acreditar nao pode coracao alguem roubar enquanto falava , homem sumiu descendo rua escapuliu repente , entao , tudo mudou turma toda contra mim virou correndo , descobri tal coracao joia pendurada cordao roubou ? fez ? brotos responderam todos vez roubou coracao devolver senao sol quadrado vai ver nascer nao vou nessa historia acreditar nao pode coracao alguem roubar enquanto falava , homem sumiu descendo rua escapuliu repente entao todo mudou turma toda contra mim virou correndo , descobri tal coracao joia pendurada cordao joia pendurada cordao joia pendurada cordao joia pendurada cordao ",Jovem Guarda,0.589,0.709,2,-10.845,0,0.0327,0.356,1.91e-05,0.229,0.971,151.138,3GDqL0krFiEwIehA9EBkFu,141013,4,jovem guarda,Roberto Carlos,https://i.scdn.co/image/45e8967f18679d0a5791c7f647d9f7ab1bc20f3c,67,975068
13,spotify:track:3ruFZOz4FEIeRHQsMjUSNR,A Volta,BRWMB9704570,37,"guardando ha bom mim dar voce chegar toda ternura todo amor guardando pra dar toda vez voce beijar vida quero entregar cada beijo , certo ficarei voce nao vai deixar grande demais sempre amor destino quis separar agora perto dia voce chegar ha bom vou entregar so vejo hora voce chegar pra todo amor poder mostrar , perto , olhar nao sei vou poder falar grande demais sempre amor destino quis separar agora perto dia voce chegar ha bom vou entregar so vejo hora voce chegar pra todo amor poder mostrar , perto , olhar nao sei vou poder falar guardando ha bom mim guardando ha bom mim guardando ha bom mim ",Jovem Guarda,0.656,0.475,10,-9.399,0,0.0311,0.373,2.63e-05,0.146,0.526,129.439,3ruFZOz4FEIeRHQsMjUSNR,240987,4,brega,Os Vips,https://i.scdn.co/image/38c928596429d53c5d60134cfccc8a448ad9f35f,26,8727
14,spotify:track:4cdLACHO2QYyzlSUJOzvtg,Pobre Menina,BRPGD9500658,0,,Jovem Guarda,0.896,0.721,7,-6.442,1,0.0339,0.574,1.57e-05,0.037,0.954,123.47,4cdLACHO2QYyzlSUJOzvtg,156373,4,jovem guarda,Lilian Wilson,,18,24
15,spotify:track:5BLsnIxsKtIUH0sMv2Z09Q,Tijolinho,FR6V82246375,31,,Jovem Guarda,0.41,0.618,9,-6.373,1,0.0336,0.523,0.000275,0.0992,0.825,157.958,5BLsnIxsKtIUH0sMv2Z09Q,128267,4,jovem guarda,Bobby De Carlo,https://i.scdn.co/image/fa7a9c5224e35ece1d972852a0ad9c271110ecbc,16,1623
16,spotify:track:1AKukOcxWvkkee6CmkAFkL,Minha Primeira Desilusão,BREMI6700030,29,tao menina pra namorarentao sera gostarde menininho tao mal pra mim ? ah ! vou crescer poder amarvou fazer forca nao chorardai talvez olhara pra mimnao pense acanhadaeu enamoradae capaz confessarentao dou piscadinhacanto musiquinhabaixinho pra poder conquistarmas percebeu enquanto cantavao imenso amor dedicavanas entrelinhas cancaoe andando enquanto choravao gosto amargo esperimentavada primeira desilusao ,Jovem Guarda,0.627,0.539,4,-5.769,1,0.028,0.818,0.000164,0.191,0.78,104.04,1AKukOcxWvkkee6CmkAFkL,197640,4,jovem guarda,Silvinha,https://i.scdn.co/image/771c9d7f05292abb9e20cc223b2d65dfea31565c,18,3046
17,spotify:track:2QmpQDqr39cfJSld8wlgnl,A Festa Do Bolinha,BREMI6500014,31,"ontem festana casa bolinhaconfesso nao gosteidos modos glorinhatoda assanhadanunca vi igualtrocava mil beijocascom raposo quintal ... porem pouco durouaquela paixaopois , bolinha ciumesformou confusaoaninha tropecoue copos derruboue casa bolinhanum inferno tornou ... bolinha provouque ciumento pra xuxue nao gosta lulubobinha eleainda chora ... tanto paodando bola salaoluluzinha gostarlogo bolao ... ",Jovem Guarda,0.656,0.754,6,-7.481,0,0.0329,0.324,0.0,0.459,0.814,131.45,2QmpQDqr39cfJSld8wlgnl,144027,4,jovem guarda,Trio Esperanca,https://i.scdn.co/image/0f8b6e2a1fac93a40f57cb6340e17f3953c22c4d,27,6286
